{
  "$schema": "../../integrations/governance/governance-policy.schema.json",
  "schemaVersion": "1.2.0",
  "status": "capability-registry",
  "rulesFile": "rules.md",
  "capabilityRegistry": "integrations/governance/enforcement-capabilities.json",
  "admissionBoundary": {
    "mode": "registry-first",
    "legacyBaseline": {
      "rulesFileGitBlobSha": "a38fbf3968aff1f81f41968013f7fe6826ee92e6",
      "operational": true
    },
    "unregisteredAdditions": "non-operative",
    "rationaleOnlyOperational": false,
    "admissions": [
      {
        "id": "ADM-RULES-001",
        "kind": "legacy-baseline",
        "rulesFileGitBlobSha": "a38fbf3968aff1f81f41968013f7fe6826ee92e6",
        "ruleIds": [],
        "note": "Freezes the pre-8F legacy rules document. Existing legacy governance remains readable during progressive migration, but later unregistered additions do not become operational governance."
      },
      {
        "id": "ADM-RULES-002",
        "kind": "registered-governance",
        "rulesFileGitBlobSha": "161c105c88d90e33fea0d5ed8c813ec11b21b6e7",
        "ruleIds": ["RULE-BE-STACK-001"],
        "note": "Admits the Rust/Axum backend default and its evidence-backed exception policy as operational governance for workflow 2.4.0."
      },
      {
        "id": "ADM-RULES-003",
        "kind": "registered-governance",
        "rulesFileGitBlobSha": "e4260658d7e4b8b4e33345183071593fdd757a38",
        "ruleIds": ["RULE-BE-LANG-001"],
        "note": "Admits the pt-BR domain identifier layer for generated backend artifacts. Technical/protocol vocabulary and control-plane governance enums stay English by the same rule."
      },
      {
        "id": "ADM-RULES-004",
        "kind": "registered-governance",
        "rulesFileGitBlobSha": "f2ef90bdf59541b9f627a4827e657b3e3641abee",
        "ruleIds": ["RULE-SDE-OPEN-QUESTION-001"],
        "note": "Admits the open-question closure convention: every Q- carries aberta/resolvida/adiada status and none may stay open past adversarial or evidence-release."
      }
    ]
  },
  "authorities": [
    {
      "id": "workflow",
      "description": "Cross-cutting workflow control plane and CI enforcement."
    },
    {
      "id": "spec-driven-engineering",
      "description": "Canonical orchestration, acceptance, evidence, handoff and common engineering governance."
    },
    {
      "id": "frontend-product-builder",
      "description": "Canonical frontend architecture, screen contracts, design-system and objective frontend validation authority."
    },
    {
      "id": "backend-product-builder",
      "description": "Canonical backend contract, boundary, reliability, security and representative-slice authority."
    },
    {
      "id": "impeccable",
      "description": "Bounded frontend visual-craft authority under canonical product and design contracts."
    },
    {
      "id": "human",
      "description": "Authority reserved for consequential decisions and explicit approval gates."
    }
  ],
  "rationaleSections": [
    {
      "anchor": "índice-de-aplicabilidade",
      "destination": "rationale",
      "reason": "Applicability index. It points at applicability.md and does not decide a gate."
    },
    {
      "anchor": "contrato-do-spec-driven-engineering",
      "destination": "rationale",
      "reason": "Workflow contract constitution. Mechanical checks live on the registered rules that cite their own sections."
    },
    {
      "anchor": "bootstrap-de-contexto-em-janela-limpa",
      "destination": "rationale",
      "reason": "Read order for a fresh context window. No file signal proves that an agent read it."
    },
    {
      "anchor": "gates-canônicos",
      "destination": "rationale",
      "reason": "Stage-order constitution. The prompt and gate graphs are already checked by validate-workflow.mjs."
    },
    {
      "anchor": "princípio-base",
      "destination": "rationale",
      "reason": "Design judgment. A linter would block legitimate code or trust a model again."
    },
    {
      "anchor": "yagni",
      "destination": "rationale",
      "reason": "Design judgment. Forgetting it creates debt, not a false gate or an unsanitized release."
    },
    {
      "anchor": "abstração-só-quando-a-dor-justificar",
      "destination": "rationale",
      "reason": "Design judgment. Same limit as YAGNI: no closed predicate over a diff."
    },
    {
      "anchor": "ddd-estratégico-e-bounded-context",
      "destination": "rationale",
      "reason": "Bounded-context judgment. No honest file signal yet; it stays rationale until one exists."
    },
    {
      "anchor": "responsabilidade-antes-de-camada",
      "destination": "rationale",
      "reason": "Design judgment about where a responsibility lives. No closed file predicate."
    },
    {
      "anchor": "encapsulamento",
      "destination": "rationale",
      "reason": "Design judgment. No mechanical signal that does not also reject legitimate modules."
    },
    {
      "anchor": "solid-pragmático",
      "destination": "rationale",
      "reason": "Design judgment. SOLID phrasing is not a closed predicate."
    },
    {
      "anchor": "bugs-e-validação",
      "destination": "rationale",
      "reason": "Bug-handling judgment. The mechanical test gates live under Testes and Gates de Teste."
    },
    {
      "anchor": "overengineering",
      "destination": "rationale",
      "reason": "Design judgment. Forgetting it creates debt, not a false gate or an unsanitized release."
    },
    {
      "anchor": "sincronização-de-docs-do-projeto",
      "destination": "rationale",
      "reason": "Doc-sync judgment. Update-only-what-changed has no closed diff predicate here."
    }
  ],
  "rules": [
    {
      "id": "RULE-SDE-ADMISSION-001",
      "domain": "workflow",
      "kind": "hard-invariant",
      "authority": "spec-driven-engineering",
      "summary": "A rules.md revision cannot introduce operational governance unless the revision is admitted through the canonical registry-first boundary.",
      "applicability": { "mode": "always" },
      "stageScopes": ["every-stage"],
      "enforcement": { "capability": "governance-rule-admission-validation" },
      "failure": { "severity": "blocking", "route": "BLOCKED" },
      "rulesReference": "rules.md#institucionalização-de-quality-gates-em-ci"
    },
    {
      "id": "RULE-SDE-PLACEHOLDER-001",
      "domain": "workflow",
      "kind": "hard-invariant",
      "authority": "spec-driven-engineering",
      "summary": "Unresolved workflow placeholders must never persist into feature artifacts.",
      "applicability": { "mode": "always" },
      "stageScopes": ["every-stage"],
      "enforcement": { "capability": "feature-package-validation" },
      "failure": { "severity": "blocking", "route": "BLOCKED" },
      "rulesReference": "rules.md#resolução-de-placeholders"
    },
    {
      "id": "RULE-SDE-LOCK-001",
      "domain": "workflow",
      "kind": "hard-invariant",
      "authority": "spec-driven-engineering",
      "summary": "Routed skill content must match the reviewed workflow lock before governed release execution.",
      "applicability": { "mode": "always" },
      "stageScopes": ["evidence-release"],
      "enforcement": { "capability": "workflow-lock-validation" },
      "failure": { "severity": "blocking", "route": "EVIDENCE_RELEASE" },
      "rulesReference": "rules.md#lock-de-versão-das-skills"
    },
    {
      "id": "RULE-BE-TEST-INTEGRITY-001",
      "domain": "backend",
      "kind": "hard-invariant",
      "authority": "backend-product-builder",
      "summary": "Backend test-file deletion, new skip/disable/focus markers, net assertion loss or disappeared contract IDs must be audited against an explicit Git baseline before release.",
      "applicability": { "mode": "conditional", "backend": ["lightweight", "substantial"] },
      "stageScopes": ["evidence-release"],
      "enforcement": { "capability": "backend-test-integrity-audit" },
      "failure": { "severity": "blocking", "route": "EVIDENCE_RELEASE" },
      "rulesReference": "rules.md#testes"
    },
    {
      "id": "RULE-FE-FAMILY-CONSISTENCY-001",
      "domain": "frontend",
      "kind": "hard-invariant",
      "authority": "frontend-product-builder",
      "summary": "Cross-screen and cross-theme semantic presentation, perceptual calibration and product semantics must remain consistent across a frontend family before adversarial review and release.",
      "applicability": { "mode": "conditional", "frontend": ["lightweight", "substantial"] },
      "stageScopes": ["adversarial", "evidence-release"],
      "enforcement": { "capability": "frontend-family-consistency-control" },
      "failure": { "severity": "blocking", "route": "PATCH" },
      "rulesReference": "rules.md#composição-visual-frontend"
    },
    {
      "id": "RULE-SDE-AUTONOMY-EVIDENCE-001",
      "domain": "workflow",
      "kind": "hard-invariant",
      "authority": "spec-driven-engineering",
      "summary": "A durable autonomy decision ledger, when one exists, must pass schema, owner, duplicity, canonical-path and durability checks before release; its absence is only valid when no decision required durable recording.",
      "applicability": { "mode": "always" },
      "stageScopes": ["evidence-release"],
      "enforcement": { "capability": "autonomy-decision-evidence-check" },
      "failure": { "severity": "blocking", "route": "EVIDENCE_RELEASE" },
      "rulesReference": "rules.md#decisão-e-escalação"
    },
    {
      "id": "RULE-FE-STYLING-001",
      "domain": "frontend",
      "kind": "hard-invariant",
      "authority": "frontend-product-builder",
      "summary": "Every user-visible frontend change must preserve a valid styling-authority contract.",
      "applicability": { "mode": "conditional", "frontend": ["lightweight", "substantial"] },
      "stageScopes": ["design-readiness", "implementation", "frontend-representative", "evidence-release"],